title,link,published,source,summary
Tesla Just Snubbed TSMC — Musk Is Quietly Building A Sovereign Chip Chain - Yahoo Finance,https://news.google.com/rss/articles/CBMingFBVV95cUxNVFR0VU5kUUNqWjNFY0RTeUdQZkxEN09zb1NzRE5LeGtYTVo3WU91bmdQS3YweFZRWWE5YUtjanluUE8yQzBURXBUUDg2akVOcTluZzZzWG54eXRuNjNNNi02Y1FPbTNHM2IwcW9tUGdudWpqWHJtTmJqdDJiOV90ODVmbnZ4S1dTZDVfRjVBVk9qOGY4YnJlQW9zOF83Zw?oc=5,2026-03-20,Yahoo Finance,Tesla Just Snubbed TSMC — Musk Is Quietly Building A Sovereign Chip Chain Yahoo Finance
Terafab—Tesla and SpaceX semiconductor factory - Jon Peddie Research,https://news.google.com/rss/articles/CBMihAFBVV95cUxOZnpPRVpGRjVuNUd1Uml3TXpvRGptUTRfOGhGTmRuZ0lYd2k1NnRJTmtERHpNOW5MOVdpWWQ3TTdvMjFsY24xOVVQcUZYUkdiODNGcXRYN2Fac2d2dDB2SFpfampRM1dtR09ZTzV2Tldtclk5ZXVneUVET2lzYmJEc3ZoUlM?oc=5,2026-03-23,Jon Peddie Research,Terafab—Tesla and SpaceX semiconductor factory Jon Peddie Research
"Report shows progress towards even cleaner EV supply chains, Tesla leads - Electrek",https://news.google.com/rss/articles/CBMipgFBVV95cUxPV1kzbENTczRraDVXVjdHSEE2dTljUl9uS2k1UkZBNjRUdFpYZUtTbDVGVkNvY0d4cXVnRFJHMUZNam9rMkRYaFNlcm9jdThoZU5YdU5PMTkyTlo2VUdUcFIxV19OZ3JEUW1qc2RPNk80MXpBTXFxRE00SnhXTWdkT1dZa2FxcHlTdU1JU3F3YlZjcng5V0tRTlhYOVBQMTlGT2R5QWtR?oc=5,2026-03-03,Electrek,"Report shows progress towards even cleaner EV supply chains, Tesla leads Electrek"
"US reveals Tesla battery deal with LG, lifting veil on supply chain - digitimes",https://news.google.com/rss/articles/CBMimAFBVV95cUxNc1piTDJLeUk3RlFXQlRFYjlpTzdmZEVaV004eDZOM3AxYllMUFVjOG9ReGViMWtBbUlvR0xVNGs4YlpFcjBzQ2VfRzBobFVjcW5LU0tjeTRqMml3dXRURjl0bS1wYnB5UG1lQW5wS2R4UXQxU1FXUDc5bm1RaWxCLXZLMmM2Tng3MGNKajliOHZMZ3JIdThxcQ?oc=5,2026-03-19,digitimes,"US reveals Tesla battery deal with LG, lifting veil on supply chain digitimes"
Tesla's vertical integration and efficiency show why they're the leader in EVs - Not a Tesla App,https://news.google.com/rss/articles/CBMiigFBVV95cUxPaC1PLVhxakIzaDQ4eHk4TmV0dE1peGhFcDZHdkxnTElWNVhCcVJYT21BY0NWX1RoWkhZbkhrd1RhczFXUHBDUkFOdXdHb0tGTjd1SWFfYVBTbXhkQmU0VzRGd3NBOG9hY3d4TVhUdW56dEJ0T0ZwT3V3R1ktX0VvZFgtc18wVkVoNmc?oc=5,2026-03-22,Not a Tesla App,Tesla's vertical integration and efficiency show why they're the leader in EVs Not a Tesla App
The world’s biggest automaker has one of the dirtiest supply chains: report - The Verge,https://news.google.com/rss/articles/CBMiogFBVV95cUxPb1NaRnB4MjBKXzRwc2xkWmZqdno0VTllRERBUVdpZFFpc3o3YTV0WmVMRDZXa3VCaVM5WkQ5Tjd1em5qdk1Va2wydnVMdnBlUXBuclNCZTlnTEd5TzNIMTJ6eGI3ZEcyNUpfRExPM0J3cURaR3JUdlB1dUV3TmdzSlpJUGhSVGdNLS1DNUhSbXBUaEo2RUdrZHlVWTkwR1Vlb0E?oc=5,2026-03-04,The Verge,The world’s biggest automaker has one of the dirtiest supply chains: report The Verge
DHL Supply Chain Accelerates Sustainability With First Tesla Semi Delivery - DHL - United States of America - DHL,https://news.google.com/rss/articles/CBMi0AFBVV95cUxQUEpSbk5WRjRBY1pLUUZQOWdwd1VxR2pUY2VXakoxWGJ2VDhWQ2VYVnVjU0dnaXIxNHQ1ZWIycE1ZR0FGUDZMeU9qVHhYbnN0X1pIWGJjenJEQ2NGdmpTblNxRTl4NTRMYWRDSm96RkVTREtSYmptZDlVOHp4U2dDOERmcFVHbFEzQUlNZ21lLTZ6SXBTVHA2S0Y0RGUxS2lxTG5OSjRVNDcxdnFYRlJ6T1lFdDV1bXZFVUFoQkN6RnlkS1M2NTBsZE9JakJYRzly?oc=5,2025-12-04,DHL,DHL Supply Chain Accelerates Sustainability With First Tesla Semi Delivery - DHL - United States of America DHL
"Tesla Picks Suppliers by Quality, Not Country, Executive Says - Bloomberg.com",https://news.google.com/rss/articles/CBMirwFBVV95cUxQUVhVV1cxeXZybzltRG1VTTMwMGNNX0dpeGJYd2RDeU1peDc4dmUxLVJfOUQ5enZDUm1UYnNDSERLTEhQajNQOThtUUUyMERXaGg1RURlWldBZVJrVkMzUlowVWtHblJlOFRoYlQxWmVOOEkwNDZydjVPYXFnbUdHWjlhTE9HbVZEdVQxd0tVVDFkZVNZZlgzZmY0cGJVWFQ2Z0NoZFRQVHBBbGZPYVp3?oc=5,2025-11-26,Bloomberg.com,"Tesla Picks Suppliers by Quality, Not Country, Executive Says Bloomberg.com"
Behind the Tesla Supply Chain - Thomasnet,https://news.google.com/rss/articles/CBMiZ0FVX3lxTE1JN1I2allRZXVYOExxUkdXX2N6TVRrRTM3NFdRSTRyelVZTk9WME05dm9uNFpVb0FkVEdJZXlZM2haM041b2FYRi1RRURiUEJEbF9KLWtBend0Z2swT2o3dVBNYzlLSlU?oc=5,2025-04-30,Thomasnet,Behind the Tesla Supply Chain Thomasnet
Tesla to Build Own Semiconductor Facility Amid Supply Chain Challenges - Intellectia AI,https://news.google.com/rss/articles/CBMipwFBVV95cUxQdTE0aHJYaWdveEZ2bUZuRlVrVm0wQjUxaExENk9lcF9kbGlzTXZNQS1PeUVQZWNqMWFYQl9jd2JSblcyTUFiTmtMdmNWY1otaE1TTEFSbkhVUGxMTENiYkJuTUR2WVVCbnpTMFd0YkNLVmZzVUVqeHhHbnpUNU0xN0hDQXMxeXYwd1laSEZJTFFvbDl2cm9GVVN6LUQ4d3daYmtBS2tGSQ?oc=5,2026-03-19,Intellectia AI,Tesla to Build Own Semiconductor Facility Amid Supply Chain Challenges Intellectia AI
"Forget about X, AI and robots—Tesla is quietly building a complete EV battery supply chain - Charged EVs",https://news.google.com/rss/articles/CBMivwFBVV95cUxOWVZ1UUZUNHhvU3lRdWJIbkRNLTFhdURwQ0pFcEtUeTZYblg5ZFhZTWJnQjZ2dU56TUkwN1B3TWZtdzRBX2N0VW9lUjloYS1HdzdNY2FZN0VjS1VTOTVnTXhRM3N3eThfV2V0WngwVWQzM1pXcE0wOHo3ZVJLRE95YzBXLUY2OXpPU2RPTXY0RW1BWjdROGdiZTVGUmJ3VkNySi1OLXNwV295WDZsdDJBTEhVbWY2NlV5WnE3S2RQNA?oc=5,2026-03-06,Charged EVs,"Forget about X, AI and robots—Tesla is quietly building a complete EV battery supply chain Charged EVs"
"Tesla accelerating shift away from China-made components, WSJ reports - CBT News",https://news.google.com/rss/articles/CBMimAFBVV95cUxNSV8tUnFZTk9OQmFXTE9MMldIcVNSR3Y1NThqcGViS1VzMG1OQnNXRTEweGZ5MjJ5X19ORnhsekhzQUZYdVY3LWVXNzNmcEdkSFhLT25WOFgtSlVkb1lEUGxrQlFxbTZJSzJMazdNOWpkSTNtUnIyMXdDUkl4WFFjMWdNUUNNMllUNUhKV0pqdGxSeWpibXQxUQ?oc=5,2025-11-17,CBT News,"Tesla accelerating shift away from China-made components, WSJ reports CBT News"
DHL Supply Chain Eyes Fleet of Tesla Semis - Transport Topics,https://news.google.com/rss/articles/CBMibEFVX3lxTE8zSks3Nmp0ZDZRNGRNRzltZ3lTSERidkpPVVY2RnBqUjc4RjQ1OTVtN2V3Y1JSWkFMMk9PNVVMUjFfdGJwYzdZVVRwYndHbzdwdWJYUkkwam1NcW0zdFQ2WVRSMG5jSzl2NUVvUA?oc=5,2025-12-29,Transport Topics,DHL Supply Chain Eyes Fleet of Tesla Semis Transport Topics
Exclusive | Tesla Wants Its American Cars to Be Built Without Any Chinese Parts - WSJ,https://news.google.com/rss/articles/CBMihANBVV95cUxQZ0M5SnpoaDBDc0gzOEZBM3pIMjBzaDNNbFVlTWMya2lLX19pMzJLaDhTVjl6UHpuZjIzWnVXV29XMXJ4TE1sakphbERJMFFiQ3h3M1kwNjFMbGNDWGU1QzdrMFVxRnRBbFZEYWNIOHhiMlVkaDdncE1qRTJzNlNqVHBPWlJWTkJvbkRHbUYtcDJ6YmV6dVlZYi1MWWkteWVldU9Xc3E3c0czSnUzLUd4Z2wxTVI5ZTBUQnpfWXY1NjhoVW44eFROTzFRR1JXYWJqVzJmbVZTekZBRW1jSmw3SXNGeHE4ZTFRZmluaWVkcDJVdEUzRFFhQXFyYm9yS1JpVGFJSlJUY0VhSnlZWU5QaEh3cVRaSllmdWFKQW9Nb0xjNHdWcWozQWRqQVRfQ2dCTUJFSy13TDl6d0hQM1ZxNjFaUm94VWpRZk1sQmllX0dpNnJxTEF1YjR0aS1Ib2hlZTFraTZoN3lSZXlsOWxSVUNaWXFmVG5HV2V0ek9qZDVlYnk5?oc=5,2025-11-15,WSJ,Exclusive | Tesla Wants Its American Cars to Be Built Without Any Chinese Parts WSJ
DHL Supply Chain deploys first Tesla Semi in net zero carbon push - FreightWaves,https://news.google.com/rss/articles/CBMioAFBVV95cUxNaGlxcUlreHZNdzBlNWk4LXVkdzhmc2VxY0dqdXZfb1dWZkRTa2M4M2ppaklDMVVqWnNLTFhYSk50T252UnJlaTROUXI3SUNiTFhLOVNQd0ttUC1DX0dxNC13NzN1MHpZSGxrbEp4UWQxcW82Yjl2X01iV1kySUtlNmN3WUctZGtOZWNPSjFuanVFcGdNOGRFOWJXUmxhdi1B?oc=5,2025-12-10,FreightWaves,DHL Supply Chain deploys first Tesla Semi in net zero carbon push FreightWaves
"When Supply-Chain Disruptions Strike, Preparation Is Everything - Kellogg Insight",https://news.google.com/rss/articles/CBMisAFBVV95cUxNcUdXb2lrNlV1b2VuZ3RPNE1tNFlFMzBXVzU2REhiLU9oN2JsSTh0Z1BUU2pjZUVDTXVRQ3dmeXFaX1k2M1VGN1RzanNqN0JDMDR3b04yNGpXS2M5c3pUNHE2NHF0R2V3Q091eXhRTHhCRHFlNnRnbjhJMEJqRTJsY3ZvWnZGMDZRM2ZiNnJGYlV1TWpkcHNOUG9BTHlrRTRGVUJ6ajV0S0VrUWFuQ1dsMA?oc=5,2025-12-09,Kellogg Insight,"When Supply-Chain Disruptions Strike, Preparation Is Everything Kellogg Insight"
Tesla requires US supply chains to strip out China-made components – report - Just Auto,https://news.google.com/rss/articles/CBMickFVX3lxTE9oOHZ6SjZreWF0TmtYaHhuYlZ4cWFHWGlLQmh0MUlxTE9fMzc2ZVRDZWw1QmtCcklNRlJKdGFhZm90ek14QXZuYlIzd2FkRDRaS1dBOHhaQ1dsVHB3R2hnVGZTNjlMRTJYNHBQdWduTTlkUQ?oc=5,2025-11-17,Just Auto,Tesla requires US supply chains to strip out China-made components – report Just Auto
Tesla in talks for $2.9bn solar equipment deal with Chinese suppliers - alcircle,https://news.google.com/rss/articles/CBMiqAFBVV95cUxQcWVrdExxN2luWW5FdlV4Q0hBWTdzVDFZaG5TQ0g5Z1hiYnowcFJoWmZoQmpBbXZJSjNZX1l5MWR2ZGFvOUJDT284Q0xmSWtzaUZGUmJuSVpURk1oMG0ySXU3R1NJS3lHaDJUOVQwdjBzUlhqN1M3a2hnRlZTN0RURmVTVWtvTWtPN2RMSlpFQkFnb2xKNVQ5X1BVNmI3bUdMb0VUcXVMMTg?oc=5,2026-03-22,alcircle,Tesla in talks for $2.9bn solar equipment deal with Chinese suppliers alcircle
Tesla’s 4680 battery supply chain collapses as partner writes down deal by 99% - Electrek,https://news.google.com/rss/articles/CBMingFBVV95cUxOTURQbnh0ZFEzak9idWRJekJxamM4bXFrQzNHZVdXMi0xMElzRk9PZWdQUURVeTJUNThkQ25uOFBkSFBwQjdNVzJEVmYwRXJEaDVnV1NiT29wazdibDZQNjZYX1JHZVNUUWc4d1p0cVFTWno0OHpUN3ZWcXhxai1naW5BM2dJZWJFLXdTNlRwZjdYWE9nUDRXby03bFRMdw?oc=5,2025-12-29,Electrek,Tesla’s 4680 battery supply chain collapses as partner writes down deal by 99% Electrek
Tesla Drops a Supply?Chain Bombshell That Could Reshape the EV Race - Yahoo Finance,https://news.google.com/rss/articles/CBMihwFBVV95cUxNbTNVY2Y4Vl9wck56TExWV1dvaklfYUFFMUt3WXlTSEE3N1dRcUVKVHZkMm0tRFVOQlB0MVVjcEtxSFZiU2hnTWtCV09LZFBMVVgxaHhIMFFJSjBMN0s4ZGNqWERVLURSNzY3QVlLYU9sd0dHckJLQUJKVkMyaUxFYjFteXo2clU?oc=5,2025-11-27,Yahoo Finance,Tesla Drops a Supply?Chain Bombshell That Could Reshape the EV Race Yahoo Finance
Tesla: The Acid-Free Future of the Lithium Supply Chain - Supply Chain Digital Magazine,https://news.google.com/rss/articles/CBMihgFBVV95cUxQM1hlcklzaWhiREVOU2o1V3RMdVNNUkhQR3NmRGVlQ01tdHd1Mjh5OHgwM2thTDRhaXBmVEd5YXpxVDNaNmlvbWwxdDB6eUxBSXlSOWRuYXhrcG9mQlNaOV9aaWZ6S0tHbWJTSUI3SmhhSExFMENDMC1qUU5qSnNlYk9FaFNNdw?oc=5,2026-02-02,Supply Chain Digital Magazine,Tesla: The Acid-Free Future of the Lithium Supply Chain Supply Chain Digital Magazine
USA: Tesla sued over alleged forced labour and greenwashing in cobalt supply chain - Business and Human Rights Centre,https://news.google.com/rss/articles/CBMizwFBVV95cUxNX1BraW9yc0ZDOGxmX2hhbjhpZnI4V2w1aXRWY3BMU2F6OEh4ZFFRZGxkMEk3ZFRNNnktd1BUQXR4cEJIaTRvOW1sTFc1MmRaU2puRHhwVG1EQWFvVnhsZ3pmRjg1WlAxM3I5R1M4ZEVGS0pudDFkUEIwNm53dTNuY3JkTERHTGxLN1h2TllVNUNSOGFwZExDQTl0R0VYUnpVYVgyLWs3MmNfM2h5QmsyYU5YMjZYdGYwZ2NZNXpHRzZfX013NEpXbWR1Mjcxb0U?oc=5,2025-08-29,Business and Human Rights Centre,USA: Tesla sued over alleged forced labour and greenwashing in cobalt supply chain Business and Human Rights Centre
DHL Supply Chain Takes Delivery of First Tesla Semi - Heavy Duty Trucking,https://news.google.com/rss/articles/CBMijgFBVV95cUxPY3J0aTN0ZHphaXdJSGk3OFdHOUVvamlnOHQ4d0JhdEtiVnlfNzEtZEZKUkd1b01IbldjdExGNEU0ajlCS1RsRU9fT2FXNVlIWl9kTUlVSWk2amdQZ1pOeUYybm1NdEdHeHV0Rktxem1jYXVDT0JDSnJIcURWRnF6U2VnclotM3VpQV9ad2ZR?oc=5,2026-01-19,Heavy Duty Trucking,DHL Supply Chain Takes Delivery of First Tesla Semi Heavy Duty Trucking
Tesla Recruiters Visit BU MET to Talk Supply Chain Opportunities - Boston University,https://news.google.com/rss/articles/CBMimAFBVV95cUxNSmItVTdnQmozLVJoUXVnLVcxX29HSlJ4SVVLMl9hMmZqNGJ3WW9jNGd6aFp6bXdwc0dYTV94MFBTZ01aR3BjYTNib1lwMllrWC1FSG5vTmJzX3dxWTJHdmNqTEYxcS1wenVVZWQ4bXRZdzA2Z3ZlNmdoVURLWmhmNm5WTlJnN203QUZYbnN5TGU2RGlackxUWg?oc=5,2025-09-29,Boston University,Tesla Recruiters Visit BU MET to Talk Supply Chain Opportunities Boston University
"Tesla says it values China suppliers, does not exclude any by origin - Reuters",https://news.google.com/rss/articles/CBMizgFBVV95cUxNSmRTNGlxdmtYQmJ6dVliQk90NFJmUWhqMmlqeVFrTkJTczI2cWRqLWNkWEx6TUdmM1dYQVJmLWNhdFhMMUJmZ3djOS03SFlZd2xLaVE4QTN1ZkRnVmduS1NhYThRSWZkclNUdEItZHFBOS1aNmdnXzJPeTUxSnNfZXg5a1dUeThmMEJsWll2NmxVQXhseWxDRXk5MDY1U2haOEoycXlXdmp3WjZIcy1kbXlKWXBNZ21qZ0pFNGNYZGhjUkZUYWQ1YkpLM0ozZw?oc=5,2025-11-25,Reuters,"Tesla says it values China suppliers, does not exclude any by origin Reuters"
Tesla To Phase Out Chinese Made Parts For US Cars Within Two Years - CleanTechnica,https://news.google.com/rss/articles/CBMipwFBVV95cUxPV1JlZ3RmNjZlRmpiQU5fNkxZVm1yMjRneV9OVVZLaEdfR28xWE9yT052bFQtQVFfM2QtZG5CckdJWWlmUHdUak1OcmtwZ0xOVUdFM1NxZkxuQi00UWhtaHNKbGxnV1JhMXNaTTlaSjhBRlRaZ21tV1J0X3Z6Ymt1X0lwcmJ6TzczUWVtb044NmpVVGd5NGZ3aDd3RDNUeHpJNTNFbGxwWdIBrAFBVV95cUxQbFVESzRRb1NTQ3JiYlBCdjFoZVdsaHVzc2RURDVlSzc4X2R2ZXVEOWR2T0c0aHVKTkdreDBHdWhfR1BNeDJmU3RpVVV0Y1JFMFVYMjZ3eWRhOGF0T3lJRjI0ay0yQUVaeTdfWHlrUDVXbTAtQ2h5Um9MNmxlNFdrYjRyY2JiVjJESllpc3p5ZmZLZVBqcV9RMF9UZ2hUU3NMRG5DaDVnX0ZPVUJo?oc=5,2025-11-18,CleanTechnica,Tesla To Phase Out Chinese Made Parts For US Cars Within Two Years CleanTechnica
"Tesla requires suppliers to avoid China-made parts for US cars, WSJ reports - Reuters",https://news.google.com/rss/articles/CBMizgFBVV95cUxPNDNYZkFjMkpycWM5TlRJY21sMFdERTJSRVJrMU81QUdsZ0l4NHNGMmt4UlFCcUVlazVURmJiS2hILS11WGprallZX3FHNnVwa0lqS3hMSjdiVDF0RDBsN0VFQ2xoSDl0QTZtTnFBMXBzTFl4NVZvb1lyUDk0czB4dUlXeUJwWVhKTTBNRVNDVTBJSFlJbndQZUZ0UkczcVFMRm50V1NLdnRzM3pTYmVIWktLQjUxaTd2QllUVllXWjh1Z3B3amNVcFpreFlwQQ?oc=5,2025-11-15,Reuters,"Tesla requires suppliers to avoid China-made parts for US cars, WSJ reports Reuters"
DHL Supply Chain integrates Tesla Semi into California fleet - electrive.com,https://news.google.com/rss/articles/CBMinwFBVV95cUxPNUFmYXlvU3ItRWRlTTVGaFRzZHVDR25wM0p4a01DV0tfVkliQ3pQY3pSNWFENG5NWVQ0SHJnS3FyU05sTW0tX2cyNHV1LUd4SUIyLU5YcGdoY2RQUWh6SFlqOTdHbGVveVFGMm5LWDNzOEpaTGNmYUlaUjdESmFDN2VvVkM4Qm9FeFZpTHh5eU1SWjI3bHpRY2Mxdm1GRGc?oc=5,2025-12-05,electrive.com,DHL Supply Chain integrates Tesla Semi into California fleet electrive.com
Tesla pushing suppliers to cut all China-made parts for US cars - Electrek,https://news.google.com/rss/articles/CBMikgFBVV95cUxORVZ6UFdxcWlzTTdmN2FEMGJZaEI4OE54ajBGYUhWamdtRWdLSTVXTWhCeHBkMS0xWTktd3VqSDF6N0FDY0plcDVpdDcxdXl0eHQwVExHREVPa2FjaUI1NFBFaVRHRkdyNHVtS2VOV1hXR2xxVmlDRnA2TktYR3FUN1lUeTBJeG9pejRLZXZkc205QQ?oc=5,2025-11-17,Electrek,Tesla pushing suppliers to cut all China-made parts for US cars Electrek
Tesla's robotics ambitions rest on the knife-edge of US-China trade relations due to its supply chain — the majority of critical materials and suppliers are located in China - Tom's Hardware,https://news.google.com/rss/articles/CBMiuAJBVV95cUxQY0o3M3BfVmZLb2VmQ2pyRDJ3ckZJOVM4c0dfMExKbzdqbU1kY2xJVFI3YXQxS0EwZjFsSVU3QUMwOW40QVM2Y2RoSEd4SFoxbHBiTkhnTFY4MTNRNkJ6MG5UQjgtcVNTQ3o0SVhaWVd3T0dyRkJtQlAyOGVta3JIUUNSbjdNcUM5LVpPUWNaZ3F6Y3E3aVZvR25zM25pSXd6d3Jfam4zcmJTdFY2a3Z0dG5SeFFRTFp3UXFOT2Z5MFRPZUlVZHgydWpzd05pRTZWVEFfVjZYYzc5LWFSZHJ5bjRSdWtNUzFHcG5BT2ZVNHNWNmNmS3R3OW9TU0ZneUoyanFQbVFOeVBRN0xTd0x3bURlWTVaeFlUVGNpc3llemViNG9uT0Qta3JSbkFGT2dFSmF4M0lLd0s?oc=5,2026-02-05,Tom's Hardware,Tesla's robotics ambitions rest on the knife-edge of US-China trade relations due to its supply chain — the majority of critical materials and suppliers are located in China Tom's Hardware
DHL adds Tesla Semi to California fleet - Trucking Dive,https://news.google.com/rss/articles/CBMinAFBVV95cUxNM0RrXzZxOWN0MkRwZG9YSkdjMHlHeG56b0tlYlpoUW92M2p3dVBpeHNxRU1EanFrOHJWNm9VclZ3eUx2bWxJYjVWWkpMdTA0Y3c5YXB0QTFzcGNTRUFlTVBMRUJWdkVZc21lUlZoMEhESGE5U1lvLVZFQ2JudGVrVlVwRko4Zk84RndodTdMNFNIWGdMa0VrVzhsRWg?oc=5,2025-12-10,Trucking Dive,DHL adds Tesla Semi to California fleet Trucking Dive
Samsung Confirms Tesla AI5 Production at New Texas Facility - Not a Tesla App,https://news.google.com/rss/articles/CBMiqgFBVV95cUxOdDBFb1ZvRnpXeS1lZk02Y0ZPdVJFbG1Nd1JIcE44ZzQ0ZjRoLV9tNlpGa3V5Mng1WW41X0lWYjNHQ0d0Qjl3S3NLLWJ2MGR3VEY3bGZUQUxmNlJWSUY1VnJxU0hfNzRMQjdwR3JZTkxmSGpxTlNuVFVlX3BSb3duOXd4d0pNVmZidkllU2VfNl9WRDBway1JMDJGZGFjTXFMSWJQcVlnY2E1dw?oc=5,2026-03-21,Not a Tesla App,Samsung Confirms Tesla AI5 Production at New Texas Facility Not a Tesla App
Tesla Stock Jumps After China VP Torches ‘China-Free’ Supply Chain Rumors — Boasts Shanghai Cranks Out The World’s Cheapest Model 3 And Y - Stocktwits,https://news.google.com/rss/articles/CBMiowJBVV95cUxNYThVVmQ0Q3liLTdKOS1tOTJoeGtja3UtNDdQb2xVRWZYNnFUbVZacjFVeWQtZ01VYUN0cVFGS05GSXB4UUlzRUxBZHJlVnp3LWVWMng0ZUlIbjNoS1VnNHpabzlJN050VkY3VWZGVjhEOHRIMGpHV3NXa1pwemdXeFNpOWNSY3dEVUl1bXlNV1Zib25wRi03UVFWdTBpcjBWaGgyUnpTNl9lbk9rb0E1dUJYaTNIMVVWQngxdXNyaFVLODNYalJxSGlLa19SMlYxTTNCRVFlRHZwV09kTVQyWWVhRi1NSzBIQWhaRm9yUFRDS0Zvajd1VWtzclE2dFhfVzk0UmZWY3ZCVXEtbnlBbkdSeVE0ZUxSRjdxZVpyMFduZTQ?oc=5,2025-11-26,Stocktwits,Tesla Stock Jumps After China VP Torches ‘China-Free’ Supply Chain Rumors — Boasts Shanghai Cranks Out The World’s Cheapest Model 3 And Y Stocktwits
Tesla and GM try and shake off Chinese parts from supply chain - ArenaEV - ArenaEV,https://news.google.com/rss/articles/CBMikAFBVV95cUxPQ2dwLUhKZVpLaTVudDFBemdRZkZmNDFqdjhlckxwcHFfTnJoTDNlRW1YSmNjYUF6RXBFMmZrYWg4WlVsSUdDNHdNQ0h0NG81ZWN3MmFiWXR3WUFmVWVtWE54dnJZTHEzRldkRmU2MUI5dGNtOGlsOExraEZfeVpTbnpNcktvMl81bFBBNkdyZm_SAYwBQVVfeXFMTUdSbktRNkZlVVU1SlJCMGFrNmRpeVZuX25pRkpHalpJQmgxTmNJSDUzeTAxaWlXNHhMOXBWUUh1RjhjMi1QbmNfWTNoRDZhWC11Q21MRlo1dTY1QVpqbTAtSzBzXzBkZEFhYUQtd3pwWUtybjF6ZHdPclZVQk5GVXdCVm10OHRMRklCcUo?oc=5,2025-11-17,ArenaEV,Tesla and GM try and shake off Chinese parts from supply chain - ArenaEV ArenaEV
Supply chain giant announces promising partnership with Tesla: 'Unlocks opportunities that were previously beyond the limits' - Yahoo Finance,https://news.google.com/rss/articles/CBMijAFBVV95cUxOSHNpV0FCMkI1eG5EdC14eHZjZ05PSWM5WFZpajBBenljUEx6YjhVVWFOSnlhMFJCUUNVdW1iRkNpbTdKNkJvdHZhRUl1bHd3d09BazVMWXVDdnlhQVRaSmJ4MmlZZ3BaQl9ldGs1Z3Q5bWNqY2l0TFFzRGRiY3lkSE5LLTZEX2kzVTZpNQ?oc=5,2026-01-07,Yahoo Finance,Supply chain giant announces promising partnership with Tesla: 'Unlocks opportunities that were previously beyond the limits' Yahoo Finance
Tesla Struggles to Keep Pace with BYD in Europe - Supply Chain Brain,https://news.google.com/rss/articles/CBMimwFBVV95cUxPZFJIeG9xU2RhWDk5U1k3WWZFeTFveWE5TFUzRzlpb1BLWDg5QW9IbW11ZS05MUh6Rm9fLXFPcHlGSDg4NzhwMTVwLWd6U0FmUk1QcDdtdFNGb2ViZzJfcXlHWUFsTGViRWZQUUxVM1VhUTFpTHMydkdqNGZaaVBneTR0T1UxU1paM3duaFlPYld4RjFwem1ESlZKOA?oc=5,2025-08-29,Supply Chain Brain,Tesla Struggles to Keep Pace with BYD in Europe Supply Chain Brain
Tesla Supply Chain Empire: Which Companies Are Fueling the EV Myth? - Moomoo,https://news.google.com/rss/articles/CBMiswFBVV95cUxQSXVsYlpvMlNRRDNJQ2lmeTJvUlA2WUFyWEtCRy11WENaZzRiU3Y3akJjLWF1cXpzd2JUNlNpYUlpSVlBS0UyVC1VVG1lcFVPVVg5VlR1dW00WFJCQ2xoektXMndQSEJJbF8wNVBPbElJbzNtaW9mOGRpMTg2MlRRenlEbTNvcTZKWVQ2QWZ2bFdpWmdVMkFHMkdXVGltR2xZRjR0X2FaM1hSdXFINTU2Nmt2MA?oc=5,2025-12-16,Moomoo,Tesla Supply Chain Empire: Which Companies Are Fueling the EV Myth? Moomoo
Tesla executive teases plan to further electrify supply chain - Teslarati,https://news.google.com/rss/articles/CBMic0FVX3lxTE9jM2U4bWhwd3ByQnVOUWtybWNWNWNUQlZvbzJpVnZlN1NUNFU1UUI0WkZBcURSMTJ0UlRsNnE0azJEQTRfNFktempVNy01MjFMa3MzQTg4X2UzNVhqNlMtR0JFbU5NTDVXbTZCSGRlYjg0emc?oc=5,2025-07-09,Teslarati,Tesla executive teases plan to further electrify supply chain Teslarati
Elon Musk's Tesla Signs $16.5 Billion Chip Supply Agreement with Samsung for Autonomous Driving and AI Chips - Logistics Viewpoints,https://news.google.com/rss/articles/CBMidkFVX3lxTFBiajJBNkVnOHpBX0pMV184UGhBR3dMM1ROclc2SzFMNl9hczRvNnAzNG15RksyMnVXUllqUEhNWVFSMXdiTWRLZHNuUWdoNlBYeGxlczNLZEFVdDVZUUFBR0UxUzFxMjhXV3o3MWhXeGNWT2JrU0E?oc=5,2025-07-28,Logistics Viewpoints,Elon Musk's Tesla Signs $16.5 Billion Chip Supply Agreement with Samsung for Autonomous Driving and AI Chips Logistics Viewpoints
"How Tesla, Costco and Paramount are Shifting Supply Chains - Supply Chain Digital Magazine",https://news.google.com/rss/articles/CBMihwFBVV95cUxPeTNSQ3ljVHh3dU80ajFFeVhrMElob1RnVGJERW8xdHBrRkhkQVpTOGdOaG1faGhLYlJPN3lmd0hBTmRIMmlBelZnZkk0QkxTdlF2cHZ3OWJibnVoNDZmemktbVV4aWc4SVIxNXUwV09YLWJFR3J1NGhtRUhjSmxPbkV3R0hCSEE?oc=5,2025-08-08,Supply Chain Digital Magazine,"How Tesla, Costco and Paramount are Shifting Supply Chains Supply Chain Digital Magazine"
Tesla loses global EV manufacturing lead to BYD - Manufacturing Today,https://news.google.com/rss/articles/CBMijgFBVV95cUxPZjlKUS1tTjZjWU9WNUFMcm45MUxUYWFnZ015Yzk2djE1Ym8tZXU2cFppSnVXcTg2Q19haHFmYVExUEpkNkxfUVdDcVJteFl2T0dEU3BQMzQ3UE9Lb2QzRDVKUGdtdFJKUUtZMm05ck5TaFRCeWU5Y0Z0MEo4aHFXRlZjbEFPUEl0RWFaRjBR?oc=5,2026-01-05,Manufacturing Today,Tesla loses global EV manufacturing lead to BYD Manufacturing Today
Tesla Explores Indian Semiconductor Suppliers to Strengthen Global Supply Chain - Assembly Magazine,https://news.google.com/rss/articles/CBMivwFBVV95cUxORUN1alRjY1RSTEp3elRVem5JUmpKUTY1ZkdYM3kyaTltejZ6VGRPT1lXeEg0dVhOR1RPMmw4bTk3eUpZTHJxakNsNi1aV2V5MEZ4dy02NEhoZkdEdDNEaWFqUXFJYVRZdEZ4YUdCVzFwTURJSkUxb1FpclNuS2lJZ3BNdzRDVXJaZHBfVngxSWNQSExpNE52c1NIbGxnLWlkUEY5eDFmdk1EVGlsQTdtaDFERFR3ZmhuRzM2eFI3aw?oc=5,2025-04-21,Assembly Magazine,Tesla Explores Indian Semiconductor Suppliers to Strengthen Global Supply Chain Assembly Magazine
Tesla moves to eliminate China-sourced components in US vehicles - Interesting Engineering,https://news.google.com/rss/articles/CBMinAFBVV95cUxPdjF3enhGSHQyNEVnWGJUTjRiYXY1VmxYSy1LLWhhMjVBcGFiRTNiOHl4ZFQwZkMwLXN3cjUxSTYteTNXaHhNUHZ6dkFDclljOXRzNmx3dEZqVGFHaWwyRzZnX0tOSFZ0X0xsTUdnSWIwYXdaLUJidUFRTVZpQzBIS25lQURPcnZxUWFuWGRQUmRXdWx3X2FiOUVDM1k?oc=5,2025-11-15,Interesting Engineering,Tesla moves to eliminate China-sourced components in US vehicles Interesting Engineering
"Ford, Mercedes, Tesla, Volvo, and Volkswagen have the most sustainable supply chains for electric vehicles - firstonline.info",https://news.google.com/rss/articles/CBMi1gFBVV95cUxQakpGUEdyel80YnhEQ0xtY3lVV1JfVTI3WlQxWlYyY2dMc2ktbDlmOFFyQ2w1b0xoSGllUkR2al9ZbHlkcWN5MjZUX2ZycFpsWE5pcTV6Sl8wX0kyZGtMTkVYQ0NVbjkwNFhqWk9IZWtZbDc2TmlVWnp0NXNydkhmNEt5dU10TEpoOWV2ZzFPcWp5S3YwSEJWOGtmc3hDZWNTbi04TlduT1d2UXNzcnpSbmZXbmUwU2xXRXpyaW5RdXc5Ym8zY1pQelBUY1ZnZkJYb1dfaW93?oc=5,2026-03-05,firstonline.info,"Ford, Mercedes, Tesla, Volvo, and Volkswagen have the most sustainable supply chains for electric vehicles firstonline.info"
Tesla-Samsung Deal Reshapes Semiconductor Supply Chains - Supply Chain Digital Magazine,https://news.google.com/rss/articles/CBMilgFBVV95cUxQZkZicTExNFVmOV9QenZMRXc0MVUxM2J2UURJQkFQRE55OGQ1SldpaFJQcTZIcnRPMi04bnhsLWdtQWVmVklsbFFBQ2hVNmtGXy1Hb2ZQS0NWWTd2bTRsc0pEOVF2bmRoWU4zbkN6elZnT0Z2YkdkbVZCcDRhTnpWVi1pZ3hMOGhPVTl0QUpPWHhyZGJsQmc?oc=5,2025-07-28,Supply Chain Digital Magazine,Tesla-Samsung Deal Reshapes Semiconductor Supply Chains Supply Chain Digital Magazine
Tesla Cybertruck’s 4680 battery supply chain collapses with over 99% drop in value - supercarblondie.com,https://news.google.com/rss/articles/CBMiiAFBVV95cUxQbUJISjl0TzcyMk1FOEVYVFVNRDZScEo5TW1UNmNpWGNKR3RKVmdrT2hrU3RjQjNQdmhuYlFBdDMtNUNqR3YtSG8xcF9MMy1PbzFhbVF2ZzlFNUhpRXlxU1A5WFBEaXlpM29FVHhLYVZTdjdMeVhsUzR3ck1qX2JIX2prVW5yN0pu?oc=5,2025-12-31,supercarblondie.com,Tesla Cybertruck’s 4680 battery supply chain collapses with over 99% drop in value supercarblondie.com
Tesla accused of misleading DC consumers about abuse in cobalt supply chain - Global Investigations Review,https://news.google.com/rss/articles/CBMivwFBVV95cUxNT3paeXg4SVNsU054dGV6OTlHM1Fub3l6REVxdDB1alB1blBLZVItZ3Z2aHFkb3pLN2VVTksyOHVWVXBpTjhNcFY3RlI2cVFuMXR4elpwZno3VEYwbC1HR0FMNWZsUDZyNUp6QUUwWmpMd1g2bXlPMUl2TjJzY1I1clRPTjNOTGhDejl0SUpXV21nV1JQQlFkaExfbE1vT0pRUUpCakNNb2RlbkpLbW9Ud3QxOUxRSEZLZzhQd3d0SQ?oc=5,2025-08-21,Global Investigations Review,Tesla accused of misleading DC consumers about abuse in cobalt supply chain Global Investigations Review
Tesla’s Cybertruck Battery Supplier Contract Slashed to Almost Zero - Supply Chain Brain,https://news.google.com/rss/articles/CBMitAFBVV95cUxPcFRaa2VYSHNHMzdETERnZkxUdHdubTh4LWZNVXc5eDhtaFhadkRXVlViM3dfRUJNSXN1YW8zYnhwYVFUVXFnWUNQOEYzRU5Lb29rMjNpT1FTWmp2NXdLV3dmTUVzQm9WWlpfMlgyRXEyaEJVajV4QUdIQk82UWphcE45X3F5bEZnQ2FzU0FGRDNvRC03Z3hOamNLTDdqVHZVSHZhU2Q4a1FjM3dDbmhyMXJERmg?oc=5,2025-12-29,Supply Chain Brain,Tesla’s Cybertruck Battery Supplier Contract Slashed to Almost Zero Supply Chain Brain
Tesla is quietly trying to build US cars with zero China-made parts - TechSpot,https://news.google.com/rss/articles/CBMikAFBVV95cUxPbzBZWlpMd1ZhX0RaQnBPc3VEeXhSTzZiM01wNEJOZC1BRnZIMkhfN2Z6d2NCcV9HQmt6bmxyc2pWWEZWamlRM1VwSXVZdnFIM1lDYzRqeldPcTFjQWIxSXNFUFpfQjdhajF5UzJrTlRTU25QaHprYkx3MWV2LTZkc1oxdTlPTjVfLWZwQUFMZVE?oc=5,2025-11-17,TechSpot,Tesla is quietly trying to build US cars with zero China-made parts TechSpot
"DHL Receives First Tesla Semi, Expands Zero-Emission Fleet Strategy - act-news.com",https://news.google.com/rss/articles/CBMingFBVV95cUxNVjNiVG1fRXgyY2x4X1N0VzZGN2ZVTDBQdWdGTk0wSVJyd29SdVpUbUZVMDhDVVhJcVRuMzEwOXJrUm9VeF9OZFEybGNnaGU5VXJMc0xkRmJkeGhKb2FCYVpZd2tHVUg5N05SRF9JaXBmTFVSS2NrUkFRWk5iQkFpS3RSVDlETXlzN1hMMnppbzJySFg3SV9JSjBSNXk3QQ?oc=5,2025-12-11,act-news.com,"DHL Receives First Tesla Semi, Expands Zero-Emission Fleet Strategy act-news.com"
Tesla Orders Complete Removal Of China-Made Parts From American Vehicle Production - ACKO Drive,https://news.google.com/rss/articles/CBMirwFBVV95cUxNOERBNW5LYXhuN3gxaGZnVXJkQ3hVODVrNDVaR010NEc1RmhtVDZZUzU5c2xDRllNTzlfRzBNVEQ3cmJrVjZTSWJYYWlYQVU2ajBSU0ZsTXlGNXZ4TXUtNnJiSHdTc25NMjkyLWRwT0xzMlNHdFFGNmVVakFrTGlOWDRyWmdCZFYxcEd4UFNqLUdMMThXOXZYVnJyUUVISGZCZmtiX0xYZlc0U3VFS3BN?oc=5,2025-11-16,ACKO Drive,Tesla Orders Complete Removal Of China-Made Parts From American Vehicle Production ACKO Drive
Ready for a Greener Future? DHL Chooses Tesla Semi for Sustainable Logistics in California - DC Velocity,https://news.google.com/rss/articles/CBMixgFBVV95cUxPLUJEWjZyOVQ1MnZ2Y0lPcUxmMXZSU19nUmE0UV9XakxEZTJ2ekNRSnZia3BibU5Gcm1fMUhiNWwwaTQ1R1dVb05aeDBqUXQ3MHNVSkJMVTFyZ0JVSEJrZVlXWDZvajVicGE4Ym81X051dkxYb2p2cS1RQ0lJLWxTZ3Jha21nM3ZBb3ZfVHoxVWdjeWUwVDEtbEdicnR6eHhHa3VDb3lNYTIwSUhjQnZ1a2d6dFJ0UzFCTDBkY3ZpVDFqWVQ3Snc?oc=5,2025-12-04,DC Velocity,Ready for a Greener Future? DHL Chooses Tesla Semi for Sustainable Logistics in California DC Velocity
